{
  "$schema": "http://json-schema.org/draft-04/schema#",
  "description": "Mapping Profile schema",
  "type": "object",
  "additionalProperties": false,
  "properties": {
    "id": {
      "description": "Unique identifier",
      "type": "string",
      "format": "uuid"
    },
    "name": {
      "description": "Mapping Profile name",
      "type": "string"
    },
    "default" : {
      "description": "Is default mapping profile",
      "type": "boolean",
      "default": false,
      "readonly": true
    },
    "description": {
      "description": "Mapping Profile description",
      "type": "string"
    },
    "recordTypes": {
      "description": "Mapping Profile records type",
      "type": "array",
      "items": {
        "type": "string",
        "$ref": "recordTypes.json"
      }
    },
    "transformations": {
      "description": "List of mapping profile transformations",
      "type": "array",
      "items": {
        "type": "object",
        "$ref": "transformations.json"
      }
    },
    "userInfo": {
      "description": "First name, last name and username of the user, who updated the Mapping Profile",
      "type": "object",
      "$ref": "userInfo.json"
    },
    "outputFormat": {
      "description": "Mapping Profile output format",
      "type": "string",
      "enum": [
        "MARC"
      ]
    },
    "metadata": {
      "description": "Metadata provided by the server",
      "type": "object",
      "$ref": "../metadata.json",
      "readonly": true
    }
  },
  "required": [
    "name",
    "recordTypes"
  ]
}
