{
  "id": "1ef7d0ac-f0a8-42b5-bbbb-c7e249009c13",
  "name": "Default holdings mapping profile",
  "default" : true,
  "description": "Default mapping profile for MARC for holdings record",
  "recordTypes": [
    "HOLDINGS"
  ],
  "outputFormat": "MARC",
  "userInfo": {
    "firstName": "System",
    "lastName": "Process",
    "userName": "system_process"
  },
  "metadata":{
    "createdDate":"2020-07-28T00:00:00Z",
    "createdByUserId":"00000000-0000-0000-0000-000000000000",
    "createdByUsername":"system_process",
    "updatedDate":"2020-07-28T00:00:00Z",
    "updatedByUserId":"00000000-0000-0000-0000-000000000000",
    "updatedByUsername":"system_process"
  }
}
