{
  "id": "3798f546-7afb-11ea-bc55-0242ac130003",
  "name": "Mapping profile",
  "description": "Mapping profile description",
  "recordTypes": [
    "INSTANCE"
  ],
  "outputFormat": "MARC",
  "transformations": [
    {
      "fieldId": "electronicAccess.linkText",
      "path": "Json path for electronicAccess[*].linkText",
      "transformation": "001",
      "enabled": true,
      "recordType": "INSTANCE"
    }
  ],
  "userInfo": {
    "firstName": "User",
    "lastName": "User",
    "userName": "@username"
  },
  "metadata": {
    "createdDate": "2019-07-22T11:22:07Z",
    "createdByUserId": "dee12548-9cee-45fa-bbae-675c1cc0ce3b",
    "createdByUsername": "janedoeuser",
    "updatedDate": "2019-07-27T13:28:54Z",
    "updatedByUserId": "dee12548-9cee-45fa-bbae-675c1cc0ce3b",
    "updatedByUsername": ""
  }
}
