{
  "id": "5d636597-a59d-4391-a270-4e79d5ba70e3",
  "name": "Default authority mapping profile",
  "default" : true,
  "description": "Default authority profile for MARC for authority record",
  "recordTypes": [
    "AUTHORITY"
  ],
  "outputFormat": "MARC",
  "userInfo": {
    "firstName": "System",
    "lastName": "Process",
    "userName": "system_process"
  },
  "metadata":{
    "createdDate":"2020-07-28T00:00:00Z",
    "createdByUserId":"00000000-0000-0000-0000-000000000000",
    "createdByUsername":"system_process",
    "updatedDate":"2020-07-28T00:00:00Z",
    "updatedByUserId":"00000000-0000-0000-0000-000000000000",
    "updatedByUsername":"system_process"
  }
}
