{
  "id": "946f57cf-08ac-451b-9ea9-56165b9353d5",
  "name": "IT Mapping profile",
  "description": "Mapping profile for Testing Int Tests",
  "recordTypes": [
    "SRS",
    "HOLDINGS"
  ],
  "outputFormat": "MARC",
  "transformations": [
    {
      "fieldId": "holdings.callnumber",
      "path": "$.holdings[*].callNumber",
      "transformation": "90011$a",
      "enabled": true,
      "recordType": "HOLDINGS"
    }
  ]
}
