{
  "id": "e40d9f2a-ae89-4c77-ace7-c87265288ed3",
  "name": "IT Mapping profile",
  "description": "Mapping profile for Testing Int Tests",
  "recordTypes": [
    "HOLDINGS"
  ],
  "outputFormat": "MARC",
  "transformations": [
    {
      "fieldId": "holdings.callnumber",
      "path": "$.holdings[*].callNumber",
      "transformation": "90011$a",
      "enabled": true,
      "recordType": "HOLDINGS"
    }
  ]
}
